Bumble Bee - playground fun	bumblebeeplaygroundfun	iOS	https://gbanga.com/gameography/bumble-bee/	Gbanga					2012					https://itunes.apple.com/app/id658286355									https://www.youtube.com/watch?v=gXgEXMWrQaE			https://gbanga.com/wp-content/uploads/2014/10/bumblebee-header.png	In the 2-player Bumble Bee game, you ARE a bumblebee and have to collect honeycombs to survive. Through the accelerometer and compass inside the phone, the player’s movements are accurately monitored and used in the gameplay.		
Buy! Bye!	buybye	iPhone	http://www.buybyegame.ch/	Marc Gruber, Stefan Spieler					2011					https://itunes.apple.com/ch/app/buy!bye!/id476605582?l=de&ls=1&mt=8	http://www.buybyegame.ch/newsKit.html								https://www.youtube.com/watch?v=Gqs91WfWQRI		http://www.buybyegame.ch/img/screens/screen02.png		BUY!BYE! is a multiplayer game for the Apple iPhone / iPad, which shows a normal day in the life of a broker in a humoristic manner.    The main goal of the game is to gather the majority of valuable stocks as fast as possible. You can play the game by touching the iPhone / iPad with either one or two fingers at the right time. The graphic style of the game is retro, with old school pixel graphics and sound. The game was developed by two Students of the Zurich University of the Arts in Switzerland.		
Byebye Mosquito	byebyemosquito	iOS, Android, Windows 8	http://www.bitforge.ch/portfolio/byebye-mosquito/	bitforge					2012																				
Cannon Crasha	cannoncrasha	iOS, Android	http://www.cannoncrasha.com/	gangogames					2013	English, Japanese				https://itunes.apple.com/us/app/cannon-crasha/id653132309, https://play.google.com/store/apps/details?id=com.gangogames.cannoncrasha									https://player.vimeo.com/video/56482457?byline=0&portrait=0&color=f0b800/		http://www.cannoncrasha.com/images/Image1_Full.jpg		Two opposing castles on one battlefield. Destroy each other with a comically large cannon, armed units and an armada of spells!  See the destruction on each castle in real time and strategize your cannon shots by using the right artillery, watching the constantly shifting wind and aiming for the essential parts of your enemies castle! Up the ante by rushing towards your enemies with strategically summoned armed units and react to the enemies actions with defensive maneuvers and spells!		
Caps’Em All	capsemall	iOS	https://itunes.apple.com/us/app/capsem-all/id825016613?mt%3D8	Zapped Cow					2014																				
CastleHustle	castlehustle	AirConsole	https://www.airconsole.com/play/party-games/castle-hustle	Julie Baechtold, Nicolas Matter, Xavier Heimgartner					2015														https://www.youtube.com/watch?v=lsHv-es-QKU	https://lh3.googleusercontent.com/qNA6DdzxySzoRWDWoAYqpw4VtlvuPr9BBZNtWhkKm61mRlA4Lz1A6ezwCEGD-FMA4mL9ek1b7NVQ4h-teeO7Zg		https://lh3.googleusercontent.com/qNA6DdzxySzoRWDWoAYqpw4VtlvuPr9BBZNtWhkKm61mRlA4Lz1A6ezwCEGD-FMA4mL9ek1b7NVQ4h-teeO7Zg	Castle Hustle is a multiplayer browser-based game for 1-6 players. Instead of playing against each other, this game is all about surviving as a team! Players work together to defend the King’s castle against an array of magical creatures, including large giants with looming green eyes. To survive in this game, players need to come up with strategies, such as maneuvering equipment, collecting ammunition, firing on attackers, managing everything the group needs, and making sure they stay alive.		
Cat Bastard	catbastard	Java	http://www.bitforge.ch/portfolio/cat-bastard/	bitforge					2006																				
Cave Zen	cavezen	iOS	http://www.colorbloks.com/	Marco Krapf					2014					https://itunes.apple.com/us/app/cave-zen/id1071727504											http://www.colorbloks.com/tl_files/colorbloks/downloads/gif/cave-zen-7.gif		Please help me to finish this cave! 		
Cemetery Rush	cemeteryrush	iOS, Android, Windows Store	https://play.google.com/store/apps/details?id=com.alpagames.CemeteryRush	Alpagames					2015					https://play.google.com/store/apps/details?id=com.alpagames.CemeteryRush, https://itunes.apple.com/us/app/cemetery-rush/id1051397407?l=fr&ls=1&mt=8										https://lh6.ggpht.com/eWQIUAeFeKMd-Qp533m_Pee9LYFS7be3_ILmKnTQZKF4jgpn1l5XqARkTlEyYwQOxMQ=w300-rw	https://lh3.googleusercontent.com/7LuGzvhU-542WaIBmueXlTEb7qOFLyh3OIlecW2Etawqz7yPSPCZZ6MK4WPgi6lySXc=h900-rw		Monsters escaped from the great mage Malthendor’s cemetery !  Help him to send them back by swiping them into their cage, but be careful, some monsters don’t get along well and Malthendor will get mad at you if you make too many mistakes !  Cemetery Rush is a fast paced, simple but addictive game ! Will you be able to memorize all the combinations ?		
Cheese Luise	cheeseluise	iOS	http://cheeseluise.com/	pixxadoo					2013																				
Cloud Chasers - Journey of Hope	cloudchasersjourneyofhope	iOS, Android	http://cloudchasersgame.com/	Blindflug Studios	Zürich				2015-10-15	EN, FR, BP, SP, DE			GDC Best in Play 2015, European Indie Game Days Grand Prize, DEIS Innovation Prize, SGDA Audience Award, IndieCade 2015 @E3 Selection										https://www.youtube.com/watch?v=0XaGBl_O5zo		http://cloudchasersgame.com/wp-content/themes/twentyfifteen/img/screen-1.jpg		A father and daughter on a desperate journey in hope for a future beyond the deserts.		
Colorbind	colorbind	iOS	http://www.nonverbal.ch/colorbind.html	Nonverbal					2010-02-18					http://itunes.apple.com/WebObjects/MZStore.woa/wa/viewSoftware?id=356126423&mt=8									https://www.youtube.com/watch?v=_Hx7u5Uiboo		http://www.nonverbal.ch/2.png		Colorbind is a puzzle game for the iPhone/iPod touch. Join the dots by weaving color strips with your finger.		
Colorooh	colorooh	iOS, Android	http://colorooh.digidingo.com/	digiDingo					2012					http://itunes.apple.com/us/app/colorooh/id551291855?mt=8	http://colorooh.digidingo.com/downloads/presskit.zip										http://colorooh.digidingo.com/match3.png		Meet the sweet Coloroohs and help them to find their right spot and color! The game contains 4 challenging game modes, each one with 200 levels!		
Coop Grill	coopgrill	iOS	http://www.bitforge.ch/portfolio/coop-grill/	bitforge					2012																				
Coop Sternenflug	coopsternenflug	iOS, Android	http://www.bitforge.ch/portfolio/coop-sternenflug/	bitforge					2011																				
Coop Sternenflug 2	coopsternenflug2	iOS	http://www.bitforge.ch/portfolio/sternenflug2/	bitforge					2012																				
Cosmic Hare	cosmichare	iOS, Android	http://www.cosmic-hare.com/	Insert Coin					2016					https://itunes.apple.com/us/app/cosmic-hare/id1137163709?l=de&ls=1&mt=8, https://play.google.com/store/apps/details?id=ch.insertcoin.cosmichare									https://www.youtube.com/watch?v=HpcGbBOxAp4		http://is3.mzstatic.com/image/thumb/Purple19/v4/99/06/df/9906dfd1-ef32-d2a2-05e2-6522f096f15b/source/520x293bb.jpg	http://www.cosmic-hare.com/imgs/title_typo_extrawide.jpg	Puzzle game with mysterious white rabbits in stellar constellations.		
CowFight - Combat de Reines	cowfightcombatdereines	IOS, Android	https://www.metamorphe.ch/	Metamorphe					2016																				
Crossbow Warrior	crossbowwarrior	PC, Mac	http://legendoftell.com/	Pixcube, MobyDick Games		Scherrer Medien GmbH        			2015					http://store.steampowered.com/app/412010/Crossbow_Warrior__The_Legend_of_William_Tell/									https://www.youtube.com/watch?v=yumiyo2C1OY				Crossbow Warrior has 29 exciting levels with 4 different game types like classical Jump'n'run-, Sniper-, TempleRun-, Boat-Levels! Experience the whole story behind the legend of William Tell with a multitude of lovely graphics!		
Crosstown Jam	crosstownjam	Java	http://www.bitforge.ch/portfolio/crosstown-jam/	bitforge					2006																				
Cube Clicker	cubeclicker	PC, Mac, Web, Linux	http://ludumdare.com/compo/ludum-dare-31/?action=preview&uid=7317	Tobias Baumann					2014													http://ludumdare.com/compo/ludum-dare-31/?action=preview&uid=7317			http://ludumdare.com/compo/wp-content/uploads/2014/12/gif4-smaller21.gif				
Darts	darts	Java	http://www.bitforge.ch/portfolio/darts/	bitforge					2004																				
Darts 2008	darts2008	Java	http://www.bitforge.ch/portfolio/darts-2008/	bitforge					2008																				
Der Polder	derpolder	iOS, Android	https://gbanga.com/gameography/the-polder/	Gbanga					2015														https://www.youtube.com/watch?v=j0LVPNq9IFs		https://gbanga.com/wp-content/uploads/2015/08/polder_screen2.jpeg		Der Polder ist eine Audio Walk App, das in der Abenteuerwelt rund um das multimediale Kunstwerk des Schweizer Theaterkollektivs 400asa und Theaterregiesseur Samuel Schwarz spielt. Gbanga setzt für den Polder im Rahmen eines Live Alternate Reality Games die App DER POLDER um. Tausende von aktiven Zuschauern erleben in Bern, Sils-Maria und Zürich ein GPS-gestütztes Audio-Abenteuer, welches unter die Haut geht.		
Dice Hockey	dicehockey	iOS	http://www.stelexsoftware.com/dice-hockey-eng	Stelex Software					2011					https://itunes.apple.com/us/app/dice-hockey/id413634851?mt=8											https://static.wixstatic.com/media/7875f4_be6aeaaa355011826c97b925ae216468.png/v1/fill/w_335,h_223,al_c,q_80,usm_0.66_1.00_0.01/7875f4_be6aeaaa355011826c97b925ae216468.png				
Digibug	digibug	Samsung Store		416Games					2013														https://www.youtube.com/watch?v=h_VRmEEPrIs		https://scontent-amt2-1.xx.fbcdn.net/v/t1.0-9/182974_465007336914510_92567280_n.png?oh=0a35a4e93661f86785fab4ab26b84b43&oe=5A50C768				
Discrimination Pong	discriminationpong	iOS, PC, Mac	http://www.and-or.ch/discriminationpong/	and-or					2010													http://www.and-or.ch/discriminationpong/downloads/DiscriminationPongGriffinPowerMate.zip	https://www.youtube.com/watch?v=JSr3DYWFpqM		http://www.and-or.ch/discriminationpong/pictures/screen2.png		DISCRIMINATION PONG is an anti-discrimination Pong-game. The GameArt project features some serious defects. It visualizes discrimination/racism, makes it playable and very tangible. The player experiences discrimination/racism first-hand while trying to establish a win in this unfair variation of Pong. The 'not so white-paddle' is discriminated in several aspects: from its visuals and its movements to the overall gamemechanic of the game. It is very hard for the discriminated player to win a match. Discrimination is implemented in different ways: the 'not-so-white-paddle' gets darker and darker. The left paddle may be slower than the right one. The ball may accelerate on the left side of the playground and become too fast to catch in time. The white paddle on the right may receive an extra ball without deserving it. And maybe worst of all, the ball never touches the right wall or paddle but loops slowly back to the left and takes on a faster pace as soon as it reaches the left side of the playground again. A very unfair game indeed! Find out what types of discrimination/racism you have to expect in DISCRIMINATION PONG. 		
DMBX series	dmbxseries	iOS	http://www.rndrln-games.com/	RNDRLN Games					2011					https://itunes.apple.com/app/id884773491															
Don't Kill Her	dontkillher	PC, Mac	http://www.wuthrer.net/dontkillher/	Wuthrer				2013-02-05							http://www.wuthrer.net/dontkillher/dl/DKH_presskit.zip							http://www.wuthrer.net/dontkillher/	https://www.youtube.com/watch?v=83qOgJ3Uj8c		http://www.wuthrer.net/dontkillher/img/screenshots/1.jpg		An oddly cute indie game featuring a seemingly dead woman, and you, playing her murderer.		
DOPPELSCOPE	doppelscope	PC, Mac	http://www.doppelscope.com/	Tobias Baumann					2009				Unity Awards 2009 Best Visual Design									http://www.doppelscope.com/			http://www.doppelscope.com/images/doppelscope_v0_3---00.jpg		Doppelscope is an abstract puzzle game that is all about the invisible relations things have to another. The game can also be considered an experimental playground and simulation our world.  Doppelscope is divided into small cubical worlds. The goal in each world is to restore a given misbalance by reconnecting and moving the things presented in the world. Of course the solution isn't always the obvious one and there is plenty of room for experimentation.		
Draw Me the Way!	drawmetheway	Samsung Store		416Games					2013																https://igfv3.s3.amazonaws.com/vkmQYRwXTY28Vb1lSLaJ_dmtw_vii_hd_1000.jpg		Draw me the way is a puzzle game for Samsung S-Pen devices. It tells the story of how a noble knight called Sir Hainrich met a powerful wizard and how they embarked on a great journey searching for gold and glory.  The player leads Sir Hainrich through dungeons by drawing arrows on the floor and thus drawing him the way.		
Drei	drei	iOS, Android, PC, Mac	http://etter.co/drei/	Etter Studio					2014																				
Dreii	dreii	PlayStation 4, PS Vita, Wii U, PC, Mac, Linux, iOS, Android	http://dreii.com	Etter Studio					2015	English, French, Italian, German, Spanish, Arabic, Dutch, Greek, Japanese, Korean, Polish, Portuguese, Russian, Simplified Chinese, Brazilian Portuguese, Swedish, Turkish			European Design Award, Swiss Game Award	http://store.steampowered.com/app/298420/, https://play.google.com/store/apps/details?id=com.etterstudio.drei, https://itunes.apple.com/us/app/etter-drei/id708388097?mt=8, https://store.playstation.com/#!/en-gb/games/dreii/cid=EP4195-CUSA03403_00-3000000000000001									https://www.youtube.com/watch?v=2qtWc72PhXs		http://dreii.com/play/img/dreii_screen_02.png		Dreii is a puzzling game about skill, logic and friendship. It subtly connects players in real-time across the world, to help one another in a battle against gravity.		
Drownings	drownings	Samsung Store		416Games					2013														https://www.youtube.com/watch?v=sIPkYoEdVlo						
Dungeon Clicker	dungeonclicker	iOS, Android	http://www.dungeonclicker.com/	Sebastian Tobler					2014-04-20					https://itunes.apple.com/us/app/dungeon-clicker/id807783916?ls=1&mt=8	http://www.dungeonclicker.com/dcpresskit.zip								https://www.youtube.com/watch?v=XQLNykkG2ww		http://www.dungeonclicker.com/pictures/dcscreen3.jpg		Don’t have time to play through Diablo? Getting tired of World of Warcraft? We’ve got you covered! ‘Dungeon Clicker’ is the answer to all your gamer needs, as it brings you the core essence of every action RPG in a distilled form for you to enjoy on a mobile device: Getting loot!		
Eco Driver	ecodriver	iOS, Android	https://www.dreipol.ch/work/ecodriver-mobile-game	Dreipol					2015					https://play.google.com/store/apps/details?id=ch.qualityAlliance.EcoDriver&hl=en, https://itunes.apple.com/us/app/ecodriver/id1039873611?mt=8									https://player.vimeo.com/video/183609390		https://lh3.googleusercontent.com/C5jPCLDGX6rtd7CCZD5WeMTQ3HqJXWNeoofty5gj1fIgtI_diB5rOft9ieO2dtzyGTyW=h900-rw		Test your driving with EcoDriver in an endless, randomly generated environment! This exciting game shows you the advantages of driving safely, economically and in an environmentally friendly way. Players must master a dangerous terrain and treacherous traffic situations, all while saving fuel and being aware of what’s up the road. Because you’ll only get ahead if you drive efficiently.		
Edgar the Explorer	edgartheexplorer	iOS	https://itunes.apple.com/ch/app/edgar-explorer-jeu-plateforme/id1100015560	Filipe Mathez, Paul Ronga					2016-09-08					https://itunes.apple.com/ch/app/edgar-explorer-jeu-plateforme/id1100015560											http://is5.mzstatic.com/image/thumb/Purple71/v4/dd/c5/a6/ddc5a652-ae68-45f6-4860-08df31c1ca9c/source/520x293bb.jpg		Kostenloses und werbefreies Jump ’n’ Run. Edgar, ein alter Schnauzbart-Träger (Du), soll ein geheimes Laboratorium untersuchen. Er kämpft gegen Versuche an Aliens bei Greenalien.		
Elarooh	elarooh	iOS, Android	http://elarooh.digidingo.com/	digiDingo					2014-05-20					https://itunes.apple.com/app/elarooh/id848291262?mt=8, https://play.google.com/store/apps/details?id=com.digidingo.elarooh									https://www.youtube.com/watch?v=3Evi13AGZm0		http://elarooh.digidingo.com/Fuchs_Gif_750px.gif		Delve into the fascinating world of Elarooh! Unleash the forces of nature to save the spirits of the magic forest. Prove your whit - only the smartest of you will solve the tricky riddles and minigames. Will you be able to solve the mystery of Elarooh?		
Electrogame	electrogame	iOS	http://www.reduktion.ch/project/electrogame/	Christian Schnellmann					2013					https://itunes.apple.com/us/app/electrogame/id656739906?l=fr&ls=1&mt=8									https://player.vimeo.com/video/69411537		http://www.reduktion.ch/wp-content/uploads/2016/09/screen_960.png		Electrogame (1977) was originally created for the SC-800 pocket calculator. My enhanced port of the game is now available for iPhone, iPad and iPod touch.		
EMC	emc	iPhone, iPod, iPad	http://www.etterstudio.com/en/emc.php	Etter studio					2011					https://itunes.apple.com/app/emc/id408430484, https://play.google.com/store/apps/details?id=com.etterstudio.emc									https://www.youtube.com/watch?v=mtlu_8-6U0Q		http://www.etterstudio.com/img/emc_3.jpg		This is an experimental game inspired by nuclear physics; such as the structure of atoms, electromagnetic forces, fusion and fission.		
Evidence	evidence	PC	http://wuthrer.net/evidence/	Wuthrer					2011-12-03													http://dl.dropbox.com/u/14394369/Evidence.zip	https://vimeo.com/33069516		http://wuthrer.net/evidence/img/01.png		Evidence is an independant, free, single player game. You’ll have to travel through teddy bears corpses lying all over a strange place. Nobody seems to love you, except for that strange post-it following you everywhere. But be careful, he doesn't seem to always tell the truth. There’s a lot of ennemies, all weird ones. Don’t be afraid, there’s one unique way to escape from each of them.  Everything you'll encounter can be explained. Jump, run and hide yourself until you reach the end of your journey, then everything will be fine, perhaps…		
Fairy King	fairyking	iOS, Android, WP8	https://play.google.com/store/apps/details?id=com.CouchDevelopers.FairyKingFree	couch developers					2014															https://lh4.ggpht.com/Z92LX5uIloX8pQ9e2hIaLR70USfDWfcsVzaeWTj8gpkfF9pG0BplVdL6-rucHfiamw=w300-rw	https://lh5.ggpht.com/oQV9qX0iUxvFJnvIepiLWqrDKhbVFX2DQuISQ_bSPt1A_o-igqHH8m5nZ9Jy0WCnWNs=h900-rw		Once upon a time the King of the Fairies went for a walk outside of his kingdom to collect flowers. All of a sudden the ground started shaking and his fairy folk were transformed into evil blocks, which seal his path home. Help the mighty Fairy King to find his way back to the fairy kingdom. Use the force of his magic wand to release the enchanted blocks, for the survival of the mighty Fairy King and his people lies now in your hands.  		
FAR: Lone Sails	farlonesails	PC, Mac, PS4, XBox One	http://www.far-game.com/	Okomotive	Zürich	Mixtvision			2018					http://store.steampowered.com/app/609320/FAR_Lone_Sails/															
Farewell	farewell	iOS		Miriam Wissel																			https://www.youtube.com/watch?v=J1eEYCmA5og				Storyline: The main character of Farewell is a young Inuit who involuntarily sets out on an adventurous quest. One day, when he goes fishing, he tries to cast his angling rod but the hook gets tangled up in his shoe. The boy falls over, hits his head on the ice, and looses consciousness. His head hit the ice so hard that as he is lying there, an ice-floe separates from the mainland and drifts out into the open sea. After a long journey halfway across the globe, he runs ashore on a mystical island in the middle of the ocean. The gamer’s task now is to collect various items and use them in a way that will enable the Inuit to escape from the island. If this task is completed successfully, the Inuit moves on to another island, which he will try to escape from again. Thus begins a journey that will take the gamer to a variety of small, atmospheric worlds which will challenge him or her with a number of sophisticated and humorous riddles.		
Farming Simulator	farmingsimulator	iOS, Android, PS3, X360, 3DS, PSVita	http://www.farming-simulator.com/	GIANTS software					2012					http://www.farming-simulator.com/buy-now.php?lang=en&country=us&platform=pc									https://www.youtube.com/watch?v=CbJBhqnJeHU		http://www.farming-simulator.com/img/content/media/fs17/screenshot12_en.jpg		Take on the role of a modern farmer in Farming Simulator 17! Explore farming possibilities in a new North American environment. Drive over 250 farming vehicles and equipment from over 75 manufacturers, including new brands such as Challenger, Fendt, Valtra or Massey Ferguson.		
Feist	feist	Unknown	http://playfeist.net/	Florian Faller, Adrian Stutz		Finji			2015-07-23	English, French, German, Italian, Spanish, Portuguese, Russian, Simplified Chinese, Traditional Chinese, Polish			Unity Awards Best Overall Game, Unity Awards Visual Excellence, GDC Play Best in Play, SGDA Swiss Game Award, Fantastic Arcade World of Metrics Award, Alexandel Clavel Foundation Culture Award	https://finji.itch.io/feist/purchase, http://store.steampowered.com/app/327060, https://store.playstation.com/#!/en-us/games/feist/cid=UP0406-CUSA05448_00-0000000000000000, https://www.microsoft.com/store/p/feist/c4zfncjgfp86									https://vimeo.com/193917360		https://playfeist.net/content/home/4-screenshots/Feist_5_1920.jpg		A desperate, savage survival experience full of stunning visuals, dynamic creatures, and a haunting soundtrack. Follow strange beasts through lonely forests, hazardous mountains, dark caves, and glowing swamps. Watch out for dangerous creatures that react to your movements and decisions, and cleverly concealed traps that will test your ability to survive. Over six years in the making, FEIST is a gorgeous hand-made adventure unlike anything else, with a cinematic presentation reminiscent of The Dark Crystal or Hedgehog in the Fog, and a tense original soundtrack by Tomek Kolczynski.		
FILD: Renegade Monsters	fildrenegademonsters	iOS, Android	https://fild.bisbog.com/en/	BISBOG SA					2016											https://fild.bisbog.com/en/			https://www.youtube.com/watch?v=ipKGwRZV9mw						
Filou	filou	iOS, Web	http://www.bitforge.ch/portfolio/filou-malbuch/	bitforge					2014																				
Daryl	daryl	iOS, Windows Phone	http://www.kariosgames.com/daryl/	Karios Games					2013					https://itunes.apple.com/us/app/daryl/id780167548?mt=8									https://www.youtube.com/watch?v=0JPkWb0fhLU		http://www.kariosgames.com/wp-content/uploads/2013/12/Screen-Shot-2015-10-06-at-17.03.46-1030x579.png		Daryl is an awesome and fun archery game! Pick up your iPhone, iPod or iPad and immerse yourself in a bow-and-arrow competition! Pick up your bow and shoot some arrows. Can you hit bullseye from 15m? How about a moving target? Or through obstacles? Prove you are the best archer there is! Hit the target on a beach or on the top of a mountain and show the world your bow skills!		
Gabarello	gabarello	iOS, Windows Phone	http://gabarello.zhdk.ch/	Centre for Serious Game Design ZHdK	Zürich				2010				European Innovative Games Award - EIGA 2010 Advancement Price (AME), Nominee of the Unity Award 2010			http://www.virtual-rehab.org/2011/program.html, http://www.wired.co.uk/wired-magazine/archive/2010/10/start/one-small-step, http://www.gamestar.de/news/branche/2321518/making_games_report.htmlMaking%20Games%20Report%20-%20Gabarello:%20Ein%20Roboter%20als%20Game%20Controller, http://www.aerzteblatt.de/archiv/78450/							https://www.youtube.com/watch?v=KMm_kfZXYZo		http://gabarello.zhdk.ch/images/GABARELLO_inGame_Screenshot_1.jpg				
MonsterUp Adventures	monsterupadventures	iOS, Windows Phone	http://www.kariosgames.com/monsterup-adventures/	Karios Games	Carouge				2013				1st prize in Microsoft-Nokia app competition in CoLab Workspace, Athens, Greece in April 2012, before its release,Top 3 finalist in Swisscom App of the Year Competition in Switzerland, November 2012,ROYAL app in AdDuplex HERO APPS benefit program, August 2015                     										https://www.youtube.com/watch?v=efxL9yUyat8		http://www.kariosgames.com/wp-content/uploads/2012/04/screen4_1.2.png		The long awaited sequel is finally here! After a short vacation in  Murloland, the adorable Monsters return to TrelloLand only to discover  that the evil Skotos has kidnapped the Trella! It’s time for action!  Make your way through the land, have fun, collect the gems and defeat  the evil Skotos and his minions before they take over TrelloLand! The  monsters are back…and so is the fun!		
MonsterUp	monsterup	iOS, Windows Phone	http://www.kariosgames.com/monsterup/	Karios Games	Carouge				2012				EPIC app in AdDuplex HERO APPS benefit program, August 2015, Winner of Best Game App award at Swiss App Awards 2012, Finalist in Swiss App Awards 2012(Best Game and App of the Year categories), Semi-finalist for Microsoft Worldwide Partner Conference 2011 (11-15/7/2011 in LA) for the Windows Phone 7 App Challenge event, Game of the Month Jan 2011                     												http://www.kariosgames.com/wp-content/uploads/2012/04/screen7.png		The little monsters in Trello Land want to go as high as possible and  have as much fun as possible at the same time! Join them and help them!  Get monster stars and unlock new monsters with your jumping skills. Each  monster features a unique special power. Discover them all! Can you get  to the end and find out what lies beyond?		
